{
  "date": "2026-08-10",
  "printed_time": "5:56 PM UTC",
  "top_five": [
    {
      "rank": 1,
      "text": "Ebola deaths near 2,000 as WHO concedes the outbreak is outrunning the response."
    },
    {
      "rank": 2,
      "text": "Expansion | The Ebola outbreak in the Democratic Republic of the Congo exceeds 1,900 dead and surpasses 4,200 confirmed infections."
    },
    {
      "rank": 3,
      "text": "Dozens of Civilians Killed, Two Missing, Eight Injured in Myanmar Airstrikes on Thandwe."
    },
    {
      "rank": 4,
      "text": "Ebola deaths near 2,000 as WHO concedes the outbreak is outrunning the response."
    },
    {
      "rank": 5,
      "text": "Israel’s siege cripples transport system in Gaza, risking return to famine in Gaza: Rights monitor."
    }
  ],
  "top_story": {
    "score": 10.0,
    "quote": "Ebola deaths near 2,000 as WHO concedes the outbreak is outrunning the response.",
    "label": "AFRICA — Ebola deaths near 2,000 as WHO concedes the outbreak is outrunning the response"
  },
  "sections": {
    "Middle East": [
      {
        "headline": "Israel’s siege cripples transport system in Gaza, risking return to famine in Gaza: Rig...",
        "score": 9.5,
        "body": "Israel’s siege cripples transport system in Gaza, risking return to famine in Gaza: Rights monitor.",
        "verified_figures": [],
        "sources": [
          {
            "name": "Anadolu Ajansı",
            "url": "https://news.google.com/rss/articles/CBMi2AFBVV95cUxOSGFZTV9aUlFRTUdKLWQ5Q0dKaVYxUTBGUzJ2QTZSR3BaS1FIY0pmbXRqZGFKSFRtaG1lM01tREZPazNRckN4eHFLMmY2cHVwaU94MjJZanRyQks3bk4zQU1Od0ZyNHN2bEJCMm5hei1RaTBvQzBBUnVqLWVPQ2I2NTRpZWU1eVNRVGtURE8yYktUSTRMbzlSMzd3ZUJfMDllZDFoTGViYmQ3VXd0bWRGd1JyYTdOaVl6Zkp5d2k3TERnTTM4NC1hQlp1ZTdEZmtpWEl4V19JQWI?oc=5"
          }
        ]
      },
      {
        "headline": "Bloomberg This Weekend | Trump Weighs Iran Options, Tracking The Ebola Outbreak Corinth...",
        "score": 9.5,
        "body": "Bloomberg This Weekend | Trump Weighs Iran Options, Tracking The Ebola Outbreak Corinthians Vs São Paulo (XqdfNkmwns).",
        "verified_figures": [],
        "sources": [
          {
            "name": "Mshale",
            "url": "https://news.google.com/rss/articles/CBMiW0FVX3lxTE1ibUxyZUhSVXhMZ0Fua3NwcU11V3BITVF1VkRDTExzUkxNdVF1dURmYkxETDJudGo5eEhPSVZZMl9WckU4OElaSk1PM0dWQmh2U1RpaDB6bHlsWnc?oc=5"
          }
        ]
      },
      {
        "headline": "Lebanese Health Ministry Reports 4,335 Killed and 12,277 Injured in Israeli Attacks Sin...",
        "score": 8.5,
        "body": "Lebanese Health Ministry Reports 4,335 Killed and 12,277 Injured in Israeli Attacks Since March.",
        "verified_figures": [
          "4,335 Killed",
          "12,277 Injured"
        ],
        "sources": [
          {
            "name": "صوت الإمارات",
            "url": "https://news.google.com/rss/articles/CBMi3gFBVV95cUxPcExzMGNwaHNDTlVkb0NNTTZHaEROYXRueTE3ZC05b2dIcnBBRjk0MFZrOUw2UkFORXpOMTF3WjVhYjRJYkh2ckwyOWNIUGlxZVJQUER5azFfT3hkWjJQcUhpN3ZuWlFEWnY1c204NWhpcDZQdTlaUmk1OUUzUjhRWjlkVkpaR2U4X1ItMW9QZ2RwR1hoaEJEdEt3aEg4UUF6STctdm5MZUFiakpxeVQ0TDNmSVJNaUNUSFc5RGdFWXpLdVUxN0RlTWFmNHNaVTA5LW42azUybzV6NnVUWXc?oc=5"
          }
        ]
      },
      {
        "headline": "Artillery shelling targets various areas in Gaza amid continued attacks",
        "score": 7.5,
        "body": "Artillery shelling targets various areas in Gaza amid continued attacks.",
        "verified_figures": [],
        "sources": [
          {
            "name": "صوت الإمارات",
            "url": "https://news.google.com/rss/articles/CBMiwAFBVV95cUxOeFlQRFBqeEhLSWxjOUhxNWhBTFJOTm0ycnUwUnlwb3djbG0zemplUzE4WEdfSU9IVzd6dW9Ccmszd3ItYlFmMVJKV290X1VUcXEtdHE3aHltTW9hSFUxNWVlSjJjTTR5eEFWMzBkME54TzhYdnVaTlFqX0xRYkRocWdycjU0WGs4c2VndXUwV0ZuR2lXLVBXcDREaVVFLVZrOC1sTURyaGtHNXhXUzI2TGZUei1wd3JoRVF2SFZRT3Q?oc=5"
          }
        ]
      }
    ],
    "Americas": [
      {
        "headline": "Nova Scotia's Ebola Trial: Why Is Canada Testing A Vaccine When It Has No Outbreak?",
        "score": 9.5,
        "body": "Nova Scotia's Ebola Trial: Why Is Canada Testing A Vaccine When It Has No Outbreak?",
        "verified_figures": [],
        "sources": [
          {
            "name": "Health and Me",
            "url": "https://news.google.com/rss/articles/CBMi1AFBVV95cUxNRU1rNlo0akFVT09jV0YzZzd5RW9lOVZHZnBmSFR2VXA4UVFnaTV0MHZUbWEwZUhlS2FzUVdvVDdSQVR6QVBISXNmTTB2aXY1ZU5CaHlYQTlCR2RXbmxEVi1EUDFldGF2U2hSX19JYTRFSmRZbEFsVHAyTHluTElzOVViTEFfU1cxR3Q5endfN3V6XzQwMVpFLXZmNTBJR09sMGdxSlMtUko3MDFNTjJqYUdTc1p5RXRDRlhaLXJHWkM4aV93SDh5T09hQ2pGcmdCMWxhWQ?oc=5"
          }
        ]
      },
      {
        "headline": "At least 77 killed after powerful earthquake hits western Colombia",
        "score": 7.5,
        "body": "At least 77 killed after powerful earthquake hits western Colombia.",
        "verified_figures": [
          "77 killed"
        ],
        "sources": [
          {
            "name": "Reuters",
            "url": "https://news.google.com/rss/articles/CBMilgFBVV95cUxOQm11YVZfbDU1RnZ6SmtvZUJDX3JZT0JpajE4MkV2TzZsRVZhRW05X1JjUnU3a093elpuM1pIdjdKa2dhSkdLY1FtYWhkd3FBSGNLcHloc0d2ck9ESmtNOG5PRDlCQkVKLTlOMEpwbl9adkozZmppWFVvbUIxV3d6WDk5WE5VcDgwazIzajlaQlZtdXA5YVE?oc=5"
          },
          {
            "name": "The Guardian",
            "url": "https://news.google.com/rss/articles/CBMijAFBVV95cUxNVlU3Yjk5TElmcWIyQU53OHI0cW02eHBKdnRfZlpuMlJSYm9QODhCRnE3MTk1Vi1ERjJVM2g2UkpReURyWVphMGRrd0NBbTZ6c0hSa2dvYkxGd0ViOFl3aDJ4eGwycnZ0ODhIc1RSc1lSX2tSVnRuWVZiSURsTGxKdElEYXdBaVdIX0JqcQ?oc=5"
          },
          {
            "name": "Xinhua",
            "url": "https://news.google.com/rss/articles/CBMifEFVX3lxTE9TY0tNN3cxU3hTV3FaVzRPNDhXQkdpNXhEMnJYS09iOXY3TUIzalV5UmRQTlJCYmluZDdkS185NmwxbHREZ0loYlNiRzlkcDRQYVZtbzFvc2k2enkwZjFScUs5SGdFcmNrUlU4Vms5MDU3em1WUE54cWUwWEM?oc=5"
          },
          {
            "name": "LiveNOW from FOX",
            "url": "https://news.google.com/rss/articles/CBMiY0FVX3lxTE5nXzRMb2pnU0R1eXUyX21TZ21ldVpQZlBUb2FiWUxpeVVXU29tSXcyM3dubmZ1RmpyWHdSUFVaYzhVdEhWVGJXb3daSk8wZ21BTXNtWlE1UGliSi1YRlRnN0VLa9IBaEFVX3lxTE5iVTYxNHVVQmFfSExUUi10V05YdU92NUhDY0tiQWlnQ1hJRE02RUdHdmM0ZVAxeXJCQm1nNkoxZ0xuX2tvYjd6UjZ3aGQ4WWNRU3U0SHkzZ3I0TDBYTkJ3X0VZd2RDeVZQ?oc=5"
          }
        ]
      },
      {
        "headline": "Multiple deaths reported, dozens of buildings damaged following magnitude 7.4 earthquak...",
        "score": 7.5,
        "body": "Multiple deaths reported, dozens of buildings damaged following magnitude 7.4 earthquake in western Colombia.",
        "verified_figures": [],
        "sources": [
          {
            "name": "FOX Weather",
            "url": "https://news.google.com/rss/articles/CBMisAFBVV95cUxPakVnMlhNTHBuOExYMTVFbjMtNWVtRnpwbU9QRE5xZ2d1S0ktOEFSN2N4U1l2TzhwWF9acHpDdFVFYk9yZXRTa1JkSS00dXZTTk5qMHl6cFk3M3F4MlBTRjc5WWtSWEt6WjFHbEpoaTZONmp1WWp3S0Y3b244UTFWMGgzUHBjY1hwNlhZemhmNWVyZEZ4SEdTVkhvcHZoalJ6aWJ6U3A0SU9VdXFpaE9qatIBtgFBVV95cUxPZlk3cFZxNmNWU2hOeG01VkJPTE1aM3dTdmNKeVpPaWloSGpkbldDdmVOc2NnYXFVR1JwYWg4bkRVWW1ISlpXS05ybGtXdWh1clFZUmotTHFEajRQX0tVT1FxV3ZweU1GQ1I0cTVyY1U1d1l4VFg0Q01sdUlmSF9MRGdZNktiQnlZNUhrdVE2S1NEbDlTNkxkTVR4UWd1RTlDUEdpUWQ1Ul9DZWlIc0pjWFNUQkZIQQ?oc=5"
          }
        ]
      },
      {
        "headline": "Dozens killed as earthquake hits Colombia, causing buildings to collapse",
        "score": 7.5,
        "body": "Dozens killed as earthquake hits Colombia, causing buildings to collapse.",
        "verified_figures": [],
        "sources": [
          {
            "name": "BBC",
            "url": "https://news.google.com/rss/articles/CBMiWkFVX3lxTE8yOUZIazBTTXJFTDZ3QjVQYWRITkJQVUFMWjQ5LVQxUHJYSjRxYk1ySkg3OGpJOHpuVTJVWUZoNXUzdVg3cGFUdU9KMDRWcWxjaUpreHpmRWN3UQ?oc=5"
          },
          {
            "name": "조선일보",
            "url": "https://news.google.com/rss/articles/CBMihAFBVV95cUxOb1hIeWVBQ0s1SGpsQS1ZT3ZwQUlZMFllWWVuZ2lmclhXdlhyMXoxM3RJYm1mb0Q2RklwLW1Yd2FHbXhpOEhCR3VTcmlxSV9IOGtsRVdXcVhsbmE5Vi1IRU82blA2bFhhdXFlZ3daS3p4LVk2ekk5YXZPZUpjQWdNaUR4QlU?oc=5"
          },
          {
            "name": "livemint.com",
            "url": "https://news.google.com/rss/articles/CBMiwwFBVV95cUxQdUlPX1lWVkFJV2xZeEpZeE1SYktEclhsc3VsZk9IUFRhRTJKNlFtazVqdHIycDhEMU1lTE9yOVhkXzBBLVNzTEZiM0F4clVGcFJqUy1tN0ZDdjdXSlFULUVYSW5VMUxvczdrZDhjdkpUWloyMTk5S3NOY2VXajV3eHo4eEo1LUk5SVhjQ3JtYkJBY2tEcUhTaEN6SnJyeV83TXRaOUVfZnFLMlZQUVBBWXh1d2xOUjBBX1Q1a0N2Tl9oQ3fSAcgBQVVfeXFMT3hWcjR6MVJkUDM5VDdBcFZQYmRoU0Z3Mi13LVEtbkY0M1JwSjVmLWFGTU5YYU5DZm1ubGdVOXNEQXlBMlJMTXQ3ZkRjV2dGN1Y3ejNRdnRmdEdnWDBxLWFIcGlZS2RQUXVkLU9ValVuYzQwUFZqdWwwcURPcUVqM182dkI5RFhaZkVMVWQ5MkRjRjZialYwbVVMNU9wQ3NULWZQT2ZPcmNFeFJPNmEyNHdDOW96OXI2blNvUXBqZUlWQnpSUG5PNjY?oc=5"
          }
        ]
      }
    ],
    "Africa": [
      {
        "headline": "Ebola deaths near 2,000 as WHO concedes the outbreak is outrunning the response",
        "score": 10.0,
        "body": "Ebola deaths near 2,000 as WHO concedes the outbreak is outrunning the response.",
        "verified_figures": [],
        "sources": [
          {
            "name": "World Socialist Web Site",
            "url": "https://news.google.com/rss/articles/CBMiaEFVX3lxTFBOU2Z6R25SOThVcGZ2aVo3Uy1VZGktUGFWZ21VUVpPOFB0WjBFQnBpbkVxLWJORlBzZi04Tnd3NlVubkU1WXczQy1WWlZSdTBUczAxVXRWSVZmaFZhYTV6VTA3bVBwQ2Fu?oc=5"
          }
        ]
      },
      {
        "headline": "Expansion | The Ebola outbreak in the Democratic Republic of the Congo exceeds 1,900 de...",
        "score": 10.0,
        "body": "Expansion | The Ebola outbreak in the Democratic Republic of the Congo exceeds 1,900 dead and surpasses 4,200 confirmed infections.",
        "verified_figures": [
          "1,900 dead"
        ],
        "sources": [
          {
            "name": "Demócrata",